conv2d_0_99.json
{"input": ["cuda -keys=cuda,gpu -max_num_threads=1024 -model=T4 -thread_warp_size=32", "conv2d_nchw.cuda", [["TENSOR", [8, 128, 128, 128], "float32"], ["TENSOR", [256, 128, 3, 3], "float32"], 1, [1, 1], 1, "float32"], {}], "config": {"index": 209618431, "code_hash": null, "entity": [["tile_f", "sp", [-1, 2, 4, 8]], ["tile_y", "sp", [-1, 1, 4, 8]], ["tile_x", "sp", [-1, 1, 16, 1]], ["tile_rc", "sp", [-1, 1]], ["tile_ry", "sp", [-1, 3]], ["tile_rx", "sp", [-1, 3]], ["auto_unroll_max_step", "ot", 1500], ["unroll_explicit", "ot", 0]]}, "result": [[0.0175498641], 0, 9.071174621582031, 1610490845.5814943], "version": 0.2, "tvm_version": "0.8.dev0"}
{"input": ["cuda -keys=cuda,gpu -max_num_threads=1024 -model=T4 -thread_warp_size=32", "conv2d_nchw.cuda", [["TENSOR", [8, 128, 64, 64], "float32"], ["TENSOR", [256, 128, 5, 5], "float32"], 1, [1, 1], 1, "float32"], {}], "config": {"index": 7820731, "code_hash": null, "entity": [["tile_f", "sp", [-1, 2, 4, 2]], ["tile_y", "sp", [-1, 1, 31, 1]], ["tile_x", "sp", [-1, 31, 1, 1]], ["tile_rc", "sp", [-1, 2]], ["tile_ry", "sp", [-1, 5]], ["tile_rx", "sp", [-1, 5]], ["auto_unroll_max_step", "ot", 1500], ["unroll_explicit", "ot", 1]]}, "result": [[0.010751551], 0, 11.447920083999634, 1610491241.1535783], "version": 0.2, "tvm_version": "0.8.dev0"}
{"input": ["cuda -keys=cuda,gpu -max_num_threads=1024 -model=T4 -thread_warp_size=32", "conv2d_nchw.cuda", [["TENSOR", [8, 128, 64, 64], "float32"], ["TENSOR", [256, 128, 3, 3], "float32"], 1, [1, 1], 1, "float32"], {}], "config": {"index": 103332030, "code_hash": null, "entity": [["tile_f", "sp", [-1, 1, 4, 8]], ["tile_y", "sp", [-1, 1, 2, 2]], ["tile_x", "sp", [-1, 1, 16, 4]], ["tile_rc", "sp", [-1, 1]], ["tile_ry", "sp", [-1, 3]], ["tile_rx", "sp", [-1, 3]], ["auto_unroll_max_step", "ot", 1500], ["unroll_explicit", "ot", 0]]}, "result": [[0.004035575292682927], 0, 2.402575969696045, 1610492387.0063198], "version": 0.2, "tvm_version": "0.8.dev0"}
{"input": ["cuda -keys=cuda,gpu -max_num_threads=1024 -model=T4 -thread_warp_size=32", "conv2d_nchw.cuda", [["TENSOR", [8, 64, 256, 256], "float32"], ["TENSOR", [128, 64, 3, 3], "float32"], 1, [1, 1], 1, "float32"], {}], "config": {"index": 253108907, "code_hash": null, "entity": [["tile_f", "sp", [-1, 1, 4, 16]], ["tile_y", "sp", [-1, 1, 1, 2]], ["tile_x", "sp", [-1, 1, 64, 2]], ["tile_rc", "sp", [-1, 1]], ["tile_ry", "sp", [-1, 3]], ["tile_rx", "sp", [-1, 3]], ["auto_unroll_max_step", "ot", 1500], ["unroll_explicit", "ot", 0]]}, "result": [[0.01635572625], 0, 4.5104758739471436, 1610493696.693694], "version": 0.2, "tvm_version": "0.8.dev0"}
{"input": ["cuda -keys=cuda,gpu -max_num_threads=1024 -model=T4 -thread_warp_size=32", "conv2d_nchw.cuda", [["TENSOR", [8, 64, 128, 128], "float32"], ["TENSOR", [128, 64, 5, 5], "float32"], 1, [1, 1], 1, "float32"], {}], "config": {"index": 496995645, "code_hash": null, "entity": [["tile_f", "sp", [-1, 4, 2, 2]], ["tile_y", "sp", [-1, 1, 7, 1]], ["tile_x", "sp", [-1, 1, 18, 7]], ["tile_rc", "sp", [-1, 1]], ["tile_ry", "sp", [-1, 5]], ["tile_rx", "sp", [-1, 5]], ["auto_unroll_max_step", "ot", 1500], ["unroll_explicit", "ot", 1]]}, "result": [[0.01036688165], 0, 5.861766338348389, 1610494748.1708295], "version": 0.2, "tvm_version": "0.8.dev0"}
{"input": ["cuda -keys=cuda,gpu -max_num_threads=1024 -model=T4 -thread_warp_size=32", "conv2d_nchw.cuda", [["TENSOR", [8, 64, 128, 128], "float32"], ["TENSOR", [128, 64, 3, 3], "float32"], 1, [1, 1], 1, "float32"], {}], "config": {"index": 133967615, "code_hash": null, "entity": [["tile_f", "sp", [-1, 2, 4, 8]], ["tile_y", "sp", [-1, 1, 1, 2]], ["tile_x", "sp", [-1, 1, 64, 2]], ["tile_rc", "sp", [-1, 1]], ["tile_ry", "sp", [-1, 3]], ["tile_rx", "sp", [-1, 3]], ["auto_unroll_max_step", "ot", 1500], ["unroll_explicit", "ot", 0]]}, "result": [[0.0042295533589743585], 0, 3.231884479522705, 1610495270.8930895], "version": 0.2, "tvm_version": "0.8.dev0"}
{"input": ["cuda -keys=cuda,gpu -max_num_threads=1024 -model=T4 -thread_warp_size=32", "conv2d_nchw.cuda", [["TENSOR", [8, 64, 64, 64], "float32"], ["TENSOR", [128, 64, 5, 5], "float32"], 1, [1, 1], 1, "float32"], {}], "config": {"index": 2386777, "code_hash": null, "entity": [["tile_f", "sp", [-1, 1, 8, 8]], ["tile_y", "sp", [-1, 2, 1, 1]], ["tile_x", "sp", [-1, 1, 31, 2]], ["tile_rc", "sp", [-1, 1]], ["tile_ry", "sp", [-1, 5]], ["tile_rx", "sp", [-1, 5]], ["auto_unroll_max_step", "ot", 1500], ["unroll_explicit", "ot", 0]]}, "result": [[0.0030323638771929825], 0, 2.803102493286133, 1610496149.3998942], "version": 0.2, "tvm_version": "0.8.dev0"}
{"input": ["cuda -keys=cuda,gpu -max_num_threads=1024 -model=T4 -thread_warp_size=32", "conv2d_nchw.cuda", [["TENSOR", [8, 64, 64, 64], "float32"], ["TENSOR", [128, 64, 3, 3], "float32"], 1, [1, 1], 1, "float32"], {}], "config": {"index": 124957636, "code_hash": null, "entity": [["tile_f", "sp", [-1, 2, 4, 4]], ["tile_y", "sp", [-1, 1, 1, 4]], ["tile_x", "sp", [-1, 1, 32, 2]], ["tile_rc", "sp", [-1, 1]], ["tile_ry", "sp", [-1, 3]], ["tile_rx", "sp", [-1, 1]], ["auto_unroll_max_step", "ot", 1500], ["unroll_explicit", "ot", 1]]}, "result": [[0.0009698747952380953], 0, 3.236758232116699, 1610497099.700304], "version": 0.2, "tvm_version": "0.8.dev0"}
{"input": ["cuda -keys=cuda,gpu -max_num_threads=1024 -model=T4 -thread_warp_size=32", "conv2d_nchw.cuda", [["TENSOR", [8, 32, 256, 256], "float32"], ["TENSOR", [64, 32, 5, 5], "float32"], 1, [1, 1], 1, "float32"], {}], "config": {"index": 1434187, "code_hash": null, "entity": [["tile_f", "sp", [-1, 2, 2, 4]], ["tile_y", "sp", [-1, 2, 1, 1]], ["tile_x", "sp", [-1, 1, 127, 2]], ["tile_rc", "sp", [-1, 1]], ["tile_ry", "sp", [-1, 5]], ["tile_rx", "sp", [-1, 5]], ["auto_unroll_max_step", "ot", 1500], ["unroll_explicit", "ot", 0]]}, "result": [[0.01180576225], 0, 13.861764430999756, 1610498468.2710388], "version": 0.2, "tvm_version": "0.8.dev0"}
{"input": ["cuda -keys=cuda,gpu -max_num_threads=1024 -model=T4 -thread_warp_size=32", "conv2d_nchw.cuda", [["TENSOR", [8, 32, 256, 256], "float32"], ["TENSOR", [64, 32, 3, 3], "float32"], 1, [1, 1], 1, "float32"], {}], "config": {"index": 208533422, "code_hash": null, "entity": [["tile_f", "sp", [-1, 2, 8, 4]], ["tile_y", "sp", [-1, 1, 2, 8]], ["tile_x", "sp", [-1, 1, 16, 1]], ["tile_rc", "sp", [-1, 2]], ["tile_ry", "sp", [-1, 3]], ["tile_rx", "sp", [-1, 3]], ["auto_unroll_max_step", "ot", 0], ["unroll_explicit", "ot", 1]]}, "result": [[0.004506008594594595], 0, 3.1327130794525146, 1610499416.9249287], "version": 0.2, "tvm_version": "0.8.dev0"}
{"input": ["cuda -keys=cuda,gpu -max_num_threads=1024 -model=T4 -thread_warp_size=32", "conv2d_nchw.cuda", [["TENSOR", [8, 32, 128, 128], "float32"], ["TENSOR", [64, 32, 5, 5], "float32"], 1, [1, 1], 1, "float32"], {}], "config": {"index": 142860884, "code_hash": null, "entity": [["tile_f", "sp", [-1, 1, 2, 8]], ["tile_y", "sp", [-1, 1, 3, 3]], ["tile_x", "sp", [-1, 1, 21, 2]], ["tile_rc", "sp", [-1, 1]], ["tile_ry", "sp", [-1, 5]], ["tile_rx", "sp", [-1, 5]], ["auto_unroll_max_step", "ot", 1500], ["unroll_explicit", "ot", 0]]}, "result": [[0.002665516577464789], 0, 3.1893022060394287, 1610499855.6263974], "version": 0.2, "tvm_version": "0.8.dev0"}
{"input": ["cuda -keys=cuda,gpu -max_num_threads=1024 -model=T4 -thread_warp_size=32", "conv2d_nchw.cuda", [["TENSOR", [8, 32, 128, 128], "float32"], ["TENSOR", [64, 32, 3, 3], "float32"], 1, [1, 1], 1, "float32"], {}], "config": {"index": 153047825, "code_hash": null, "entity": [["tile_f", "sp", [-1, 1, 2, 16]], ["tile_y", "sp", [-1, 2, 1, 2]], ["tile_x", "sp", [-1, 1, 64, 2]], ["tile_rc", "sp", [-1, 1]], ["tile_ry", "sp", [-1, 3]], ["tile_rx", "sp", [-1, 1]], ["auto_unroll_max_step", "ot", 1500], ["unroll_explicit", "ot", 1]]}, "result": [[0.0010168572], 0, 4.3645875453948975, 1610500598.0210612], "version": 0.2, "tvm_version": "0.8.dev0"}
{"input": ["cuda -keys=cuda,gpu -max_num_threads=1024 -model=T4 -thread_warp_size=32", "conv2d_nchw.cuda", [["TENSOR", [8, 32, 64, 64], "float32"], ["TENSOR", [64, 32, 5, 5], "float32"], 1, [1, 1], 1, "float32"], {}], "config": {"index": 2982491, "code_hash": null, "entity": [["tile_f", "sp", [-1, 1, 4, 8]], ["tile_y", "sp", [-1, 2, 1, 1]], ["tile_x", "sp", [-1, 1, 31, 2]], ["tile_rc", "sp", [-1, 1]], ["tile_ry", "sp", [-1, 5]], ["tile_rx", "sp", [-1, 5]], ["auto_unroll_max_step", "ot", 1500], ["unroll_explicit", "ot", 1]]}, "result": [[0.000791762506122449], 0, 3.3789637088775635, 1610501624.188874], "version": 0.2, "tvm_version": "0.8.dev0"}
{"input": ["cuda -keys=cuda,gpu -max_num_threads=1024 -model=T4 -thread_warp_size=32", "conv2d_nchw.cuda", [["TENSOR", [8, 32, 64, 64], "float32"], ["TENSOR", [64, 32, 3, 3], "float32"], 1, [1, 1], 1, "float32"], {}], "config": {"index": 32348879, "code_hash": null, "entity": [["tile_f", "sp", [-1, 2, 4, 4]], ["tile_y", "sp", [-1, 1, 1, 4]], ["tile_x", "sp", [-1, 1, 32, 2]], ["tile_rc", "sp", [-1, 1]], ["tile_ry", "sp", [-1, 3]], ["tile_rx", "sp", [-1, 1]], ["auto_unroll_max_step", "ot", 1500], ["unroll_explicit", "ot", 0]]}, "result": [[0.0002660462164179105], 0, 3.1906933784484863, 1610502699.7225637], "version": 0.2, "tvm_version": "0.8.dev0"}
{"input": ["cuda -keys=cuda,gpu -max_num_threads=1024 -model=T4 -thread_warp_size=32", "conv2d_nchw.cuda", [["TENSOR", [4, 128, 128, 128], "float32"], ["TENSOR", [256, 128, 5, 5], "float32"], 1, [1, 1], 1, "float32"], {}], "config": {"index": 780045210, "code_hash": null, "entity": [["tile_f", "sp", [-1, 1, 4, 8]], ["tile_y", "sp", [-1, 1, 6, 1]], ["tile_x", "sp", [-1, 1, 21, 6]], ["tile_rc", "sp", [-1, 1]], ["tile_ry", "sp", [-1, 5]], ["tile_rx", "sp", [-1, 5]], ["auto_unroll_max_step", "ot", 1500], ["unroll_explicit", "ot", 1]]}, "result": [[0.020248208900000002], 0, 5.460068941116333, 1610504556.2072275], "version": 0.2, "tvm_version": "0.8.dev0"}
{"input": ["cuda -keys=cuda,gpu -max_num_threads=1024 -model=T4 -thread_warp_size=32", "conv2d_nchw.cuda", [["TENSOR", [4, 128, 128, 128], "float32"], ["TENSOR", [256, 128, 3, 3], "float32"], 1, [1, 1], 1, "float32"], {}], "config": {"index": 210335686, "code_hash": null, "entity": [["tile_f", "sp", [-1, 2, 4, 8]], ["tile_y", "sp", [-1, 2, 1, 1]], ["tile_x", "sp", [-1, 1, 64, 2]], ["tile_rc", "sp", [-1, 1]], ["tile_ry", "sp", [-1, 3]], ["tile_rx", "sp", [-1, 3]], ["auto_unroll_max_step", "ot", 1500], ["unroll_explicit", "ot", 0]]}, "result": [[0.00808826035], 0, 11.494817972183228, 1610505534.8977532], "version": 0.2, "tvm_version": "0.8.dev0"}
{"input": ["cuda -keys=cuda,gpu -max_num_threads=1024 -model=T4 -thread_warp_size=32", "conv2d_nchw.cuda", [["TENSOR", [4, 128, 64, 64], "float32"], ["TENSOR", [256, 128, 5, 5], "float32"], 1, [1, 1], 1, "float32"], {}], "config": {"index": 6426816, "code_hash": null, "entity": [["tile_f", "sp", [-1, 1, 8, 2]], ["tile_y", "sp", [-1, 1, 31, 1]], ["tile_x", "sp", [-1, 31, 1, 1]], ["tile_rc", "sp", [-1, 1]], ["tile_ry", "sp", [-1, 5]], ["tile_rx", "sp", [-1, 5]], ["auto_unroll_max_step", "ot", 512], ["unroll_explicit", "ot", 1]]}, "result": [[0.0057183453125], 0, 3.1641719341278076, 1610506343.187998], "version": 0.2, "tvm_version": "0.8.dev0"}
{"input": ["cuda -keys=cuda,gpu -max_num_threads=1024 -model=T4 -thread_warp_size=32", "conv2d_nchw.cuda", [["TENSOR", [4, 128, 64, 64], "float32"], ["TENSOR", [256, 128, 3, 3], "float32"], 1, [1, 1], 1, "float32"], {}], "config": {"index": 84495465, "code_hash": null, "entity": [["tile_f", "sp", [-1, 1, 4, 8]], ["tile_y", "sp", [-1, 2, 1, 2]], ["tile_x", "sp", [-1, 1, 32, 2]], ["tile_rc", "sp", [-1, 1]], ["tile_ry", "sp", [-1, 3]], ["tile_rx", "sp", [-1, 1]], ["auto_unroll_max_step", "ot", 1500], ["unroll_explicit", "ot", 0]]}, "result": [[0.0019218646509433963], 0, 3.1758573055267334, 1610507178.7744136], "version": 0.2, "tvm_version": "0.8.dev0"}
{"input": ["cuda -keys=cuda,gpu -max_num_threads=1024 -model=T4 -thread_warp_size=32", "conv2d_nchw.cuda", [["TENSOR", [4, 64, 256, 256], "float32"], ["TENSOR", [128, 64, 5, 5], "float32"], 1, [1, 1], 1, "float32"], {}], "config": {"index": 2387730, "code_hash": null, "entity": [["tile_f", "sp", [-1, 1, 2, 8]], ["tile_y", "sp", [-1, 1, 1, 2]], ["tile_x", "sp", [-1, 1, 127, 2]], ["tile_rc", "sp", [-1, 1]], ["tile_ry", "sp", [-1, 5]], ["tile_rx", "sp", [-1, 5]], ["auto_unroll_max_step", "ot", 1500], ["unroll_explicit", "ot", 0]]}, "result": [[0.02232332535], 0, 15.4817636013031, 1610508110.1945162], "version": 0.2, "tvm_version": "0.8.dev0"}
{"input": ["cuda -keys=cuda,gpu -max_num_threads=1024 -model=T4 -thread_warp_size=32", "conv2d_nchw.cuda", [["TENSOR", [4, 64, 256, 256], "float32"], ["TENSOR", [128, 64, 3, 3], "float32"], 1, [1, 1], 1, "float32"], {}], "config": {"index": 259587802, "code_hash": null, "entity": [["tile_f", "sp", [-1, 1, 16, 4]], ["tile_y", "sp", [-1, 1, 1, 4]], ["tile_x", "sp", [-1, 1, 32, 2]], ["tile_rc", "sp", [-1, 4]], ["tile_ry", "sp", [-1, 3]], ["tile_rx", "sp", [-1, 3]], ["auto_unroll_max_step", "ot", 1500], ["unroll_explicit", "ot", 0]]}, "result": [[0.0084382803], 0, 3.452188730239868, 1610509128.0274546], "version": 0.2, "tvm_version": "0.8.dev0"}
{"input": ["cuda -keys=cuda,gpu -max_num_threads=1024 -model=T4 -thread_warp_size=32", "conv2d_nchw.cuda", [["TENSOR", [4, 64, 128, 128], "float32"], ["TENSOR", [128, 64, 5, 5], "float32"], 1, [1, 1], 1, "float32"], {}], "config": {"index": 495610046, "code_hash": null, "entity": [["tile_f", "sp", [-1, 2, 1, 8]], ["tile_y", "sp", [-1, 6, 1, 1]], ["tile_x", "sp", [-1, 1, 126, 1]], ["tile_rc", "sp", [-1, 1]], ["tile_ry", "sp", [-1, 5]], ["tile_rx", "sp", [-1, 5]], ["auto_unroll_max_step", "ot", 1500], ["unroll_explicit", "ot", 1]]}, "result": [[0.004947589757575758], 0, 5.288686752319336, 1610510626.4334292], "version": 0.2, "tvm_version": "0.8.dev0"}
{"input": ["cuda -keys=cuda,gpu -max_num_threads=1024 -model=T4 -thread_warp_size=32", "conv2d_nchw.cuda", [["TENSOR", [4, 64, 128, 128], "float32"], ["TENSOR", [128, 64, 3, 3], "float32"], 1, [1, 1], 1, "float32"], {}], "config": {"index": 254510144, "code_hash": null, "entity": [["tile_f", "sp", [-1, 1, 2, 16]], ["tile_y", "sp", [-1, 2, 1, 2]], ["tile_x", "sp", [-1, 2, 64, 1]], ["tile_rc", "sp", [-1, 1]], ["tile_ry", "sp", [-1, 3]], ["tile_rx", "sp", [-1, 1]], ["auto_unroll_max_step", "ot", 1500], ["unroll_explicit", "ot", 1]]}, "result": [[0.0020313119361702126], 0, 17.440740823745728, 1610511143.5728097], "version": 0.2, "tvm_version": "0.8.dev0"}
{"input": ["cuda -keys=cuda,gpu -max_num_threads=1024 -model=T4 -thread_warp_size=32", "conv2d_nchw.cuda", [["TENSOR", [4, 64, 64, 64], "float32"], ["TENSOR", [128, 64, 5, 5], "float32"], 1, [1, 1], 1, "float32"], {}], "config": {"index": 4968217, "code_hash": null, "entity": [["tile_f", "sp", [-1, 1, 8, 8]], ["tile_y", "sp", [-1, 1, 1, 2]], ["tile_x", "sp", [-1, 1, 31, 2]], ["tile_rc", "sp", [-1, 1]], ["tile_ry", "sp", [-1, 5]], ["tile_rx", "sp", [-1, 5]], ["auto_unroll_max_step", "ot", 1500], ["unroll_explicit", "ot", 1]]}, "result": [[0.0015482991440677967], 0, 10.08223843574524, 1610511924.707815], "version": 0.2, "tvm_version": "0.8.dev0"}
{"input": ["cuda -keys=cuda,gpu -max_num_threads=1024 -model=T4 -thread_warp_size=32", "conv2d_nchw.cuda", [["TENSOR", [4, 64, 64, 64], "float32"], ["TENSOR", [128, 64, 3, 3], "float32"], 1, [1, 1], 1, "float32"], {}], "config": {"index": 124957636, "code_hash": null, "entity": [["tile_f", "sp", [-1, 2, 4, 4]], ["tile_y", "sp", [-1, 1, 1, 4]], ["tile_x", "sp", [-1, 1, 32, 2]], ["tile_rc", "sp", [-1, 1]], ["tile_ry", "sp", [-1, 3]], ["tile_rx", "sp", [-1, 1]], ["auto_unroll_max_step", "ot", 1500], ["unroll_explicit", "ot", 1]]}, "result": [[0.0005088445714285714], 0, 5.637001276016235, 1610512737.8265722], "version": 0.2, "tvm_version": "0.8.dev0"}
{"input": ["cuda -keys=cuda,gpu -max_num_threads=1024 -model=T4 -thread_warp_size=32", "conv2d_nchw.cuda", [["TENSOR", [4, 32, 256, 256], "float32"], ["TENSOR", [64, 32, 5, 5], "float32"], 1, [1, 1], 1, "float32"], {}], "config": {"index": 2982494, "code_hash": null, "entity": [["tile_f", "sp", [-1, 1, 1, 16]], ["tile_y", "sp", [-1, 2, 1, 1]], ["tile_x", "sp", [-1, 1, 127, 2]], ["tile_rc", "sp", [-1, 1]], ["tile_ry", "sp", [-1, 5]], ["tile_rx", "sp", [-1, 5]], ["auto_unroll_max_step", "ot", 1500], ["unroll_explicit", "ot", 1]]}, "result": [[0.00561762815625], 0, 10.092123031616211, 1610513690.4869635], "version": 0.2, "tvm_version": "0.8.dev0"}
{"input": ["cuda -keys=cuda,gpu -max_num_threads=1024 -model=T4 -thread_warp_size=32", "conv2d_nchw.cuda", [["TENSOR", [4, 32, 256, 256], "float32"], ["TENSOR", [64, 32, 3, 3], "float32"], 1, [1, 1], 1, "float32"], {}], "config": {"index": 316677139, "code_hash": null, "entity": [["tile_f", "sp", [-1, 1, 4, 16]], ["tile_y", "sp", [-1, 1, 1, 2]], ["tile_x", "sp", [-1, 1, 64, 2]], ["tile_rc", "sp", [-1, 1]], ["tile_ry", "sp", [-1, 3]], ["tile_rx", "sp", [-1, 3]], ["auto_unroll_max_step", "ot", 1500], ["unroll_explicit", "ot", 1]]}, "result": [[0.00212126275], 0, 3.4164557456970215, 1610514329.344615], "version": 0.2, "tvm_version": "0.8.dev0"}
{"input": ["cuda -keys=cuda,gpu -max_num_threads=1024 -model=T4 -thread_warp_size=32", "conv2d_nchw.cuda", [["TENSOR", [4, 32, 128, 128], "float32"], ["TENSOR", [64, 32, 5, 5], "float32"], 1, [1, 1], 1, "float32"], {}], "config": {"index": 297472214, "code_hash": null, "entity": [["tile_f", "sp", [-1, 1, 1, 16]], ["tile_y", "sp", [-1, 3, 1, 2]], ["tile_x", "sp", [-1, 1, 126, 1]], ["tile_rc", "sp", [-1, 1]], ["tile_ry", "sp", [-1, 5]], ["tile_rx", "sp", [-1, 5]], ["auto_unroll_max_step", "ot", 1500], ["unroll_explicit", "ot", 1]]}, "result": [[0.0012875569361702128], 0, 3.312173843383789, 1610515257.6131592], "version": 0.2, "tvm_version": "0.8.dev0"}
{"input": ["cuda -keys=cuda,gpu -max_num_threads=1024 -model=T4 -thread_warp_size=32", "conv2d_nchw.cuda", [["TENSOR", [4, 32, 128, 128], "float32"], ["TENSOR", [64, 32, 3, 3], "float32"], 1, [1, 1], 1, "float32"], {}], "config": {"index": 65938727, "code_hash": null, "entity": [["tile_f", "sp", [-1, 1, 4, 8]], ["tile_y", "sp", [-1, 1, 1, 4]], ["tile_x", "sp", [-1, 1, 32, 2]], ["tile_rc", "sp", [-1, 1]], ["tile_ry", "sp", [-1, 3]], ["tile_rx", "sp", [-1, 1]], ["auto_unroll_max_step", "ot", 1500], ["unroll_explicit", "ot", 0]]}, "result": [[0.0005355178850855746], 0, 10.567069053649902, 1610516507.859518], "version": 0.2, "tvm_version": "0.8.dev0"}
{"input": ["cuda -keys=cuda,gpu -max_num_threads=1024 -model=T4 -thread_warp_size=32", "conv2d_nchw.cuda", [["TENSOR", [4, 32, 64, 64], "float32"], ["TENSOR", [64, 32, 5, 5], "float32"], 1, [1, 1], 1, "float32"], {}], "config": {"index": 2983163, "code_hash": null, "entity": [["tile_f", "sp", [-1, 1, 4, 8]], ["tile_y", "sp", [-1, 1, 1, 2]], ["tile_x", "sp", [-1, 1, 31, 2]], ["tile_rc", "sp", [-1, 1]], ["tile_ry", "sp", [-1, 5]], ["tile_rx", "sp", [-1, 5]], ["auto_unroll_max_step", "ot", 1500], ["unroll_explicit", "ot", 1]]}, "result": [[0.0004107793638392857], 0, 14.63017201423645, 1610517633.689108], "version": 0.2, "tvm_version": "0.8.dev0"}
{"input": ["cuda -keys=cuda,gpu -max_num_threads=1024 -model=T4 -thread_warp_size=32", "conv2d_nchw.cuda", [["TENSOR", [4, 32, 64, 64], "float32"], ["TENSOR", [64, 32, 3, 3], "float32"], 1, [1, 1], 1, "float32"], {}], "config": {"index": 75024827, "code_hash": null, "entity": [["tile_f", "sp", [-1, 2, 4, 4]], ["tile_y", "sp", [-1, 1, 1, 8]], ["tile_x", "sp", [-1, 1, 32, 2]], ["tile_rc", "sp", [-1, 1]], ["tile_ry", "sp", [-1, 3]], ["tile_rx", "sp", [-1, 1]], ["auto_unroll_max_step", "ot", 1500], ["unroll_explicit", "ot", 1]]}, "result": [[0.00014219023725981622], 0, 7.55321192741394, 1610518538.4921756], "version": 0.2, "tvm_version": "0.8.dev0"}
{"input": ["cuda -keys=cuda,gpu -max_num_threads=1024 -model=T4 -thread_warp_size=32", "conv2d_nchw.cuda", [["TENSOR", [2, 128, 256, 256], "float32"], ["TENSOR", [256, 128, 3, 3], "float32"], 1, [1, 1], 1, "float32"], {}], "config": {"index": 397383621, "code_hash": null, "entity": [["tile_f", "sp", [-1, 4, 4, 4]], ["tile_y", "sp", [-1, 1, 1, 2]], ["tile_x", "sp", [-1, 2, 32, 2]], ["tile_rc", "sp", [-1, 1]], ["tile_ry", "sp", [-1, 3]], ["tile_rx", "sp", [-1, 3]], ["auto_unroll_max_step", "ot", 1500], ["unroll_explicit", "ot", 0]]}, "result": [[0.01645052785], 0, 19.57680058479309, 1610520092.7971377], "version": 0.2, "tvm_version": "0.8.dev0"}
{"input": ["cuda -keys=cuda,gpu -max_num_threads=1024 -model=T4 -thread_warp_size=32", "conv2d_nchw.cuda", [["TENSOR", [2, 128, 128, 128], "float32"], ["TENSOR", [256, 128, 5, 5], "float32"], 1, [1, 1], 1, "float32"], {}], "config": {"index": 778624358, "code_hash": null, "entity": [["tile_f", "sp", [-1, 4, 1, 4]], ["tile_y", "sp", [-1, 3, 1, 2]], ["tile_x", "sp", [-1, 1, 126, 1]], ["tile_rc", "sp", [-1, 1]], ["tile_ry", "sp", [-1, 5]], ["tile_rx", "sp", [-1, 5]], ["auto_unroll_max_step", "ot", 1500], ["unroll_explicit", "ot", 1]]}, "result": [[0.00965331275], 0, 3.4179868698120117, 1610521070.2028947], "version": 0.2, "tvm_version": "0.8.dev0"}
{"input": ["cuda -keys=cuda,gpu -max_num_threads=1024 -model=T4 -thread_warp_size=32", "conv2d_nchw.cuda", [["TENSOR", [2, 128, 128, 128], "float32"], ["TENSOR", [256, 128, 3, 3], "float32"], 1, [1, 1], 1, "float32"], {}], "config": {"index": 400406280, "code_hash": null, "entity": [["tile_f", "sp", [-1, 1, 4, 8]], ["tile_y", "sp", [-1, 1, 1, 4]], ["tile_x", "sp", [-1, 2, 32, 2]], ["tile_rc", "sp", [-1, 1]], ["tile_ry", "sp", [-1, 3]], ["tile_rx", "sp", [-1, 1]], ["auto_unroll_max_step", "ot", 1500], ["unroll_explicit", "ot", 1]]}, "result": [[0.003911958744186046], 0, 4.110664367675781, 1610522208.9033518], "version": 0.2, "tvm_version": "0.8.dev0"}
{"input": ["cuda -keys=cuda,gpu -max_num_threads=1024 -model=T4 -thread_warp_size=32", "conv2d_nchw.cuda", [["TENSOR", [2, 128, 64, 64], "float32"], ["TENSOR", [256, 128, 5, 5], "float32"], 1, [1, 1], 1, "float32"], {}], "config": {"index": 5075130, "code_hash": null, "entity": [["tile_f", "sp", [-1, 1, 4, 2]], ["tile_y", "sp", [-1, 1, 31, 1]], ["tile_x", "sp", [-1, 31, 1, 1]], ["tile_rc", "sp", [-1, 1]], ["tile_ry", "sp", [-1, 5]], ["tile_rx", "sp", [-1, 5]], ["auto_unroll_max_step", "ot", 0], ["unroll_explicit", "ot", 1]]}, "result": [[0.0030883320714285714], 0, 4.657339334487915, 1610523340.5634167], "version": 0.2, "tvm_version": "0.8.dev0"}
{"input": ["cuda -keys=cuda,gpu -max_num_threads=1024 -model=T4 -thread_warp_size=32", "conv2d_nchw.cuda", [["TENSOR", [2, 128, 64, 64], "float32"], ["TENSOR", [256, 128, 3, 3], "float32"], 1, [1, 1], 1, "float32"], {}], "config": {"index": 196265780, "code_hash": null, "entity": [["tile_f", "sp", [-1, 2, 4, 4]], ["tile_y", "sp", [-1, 1, 1, 4]], ["tile_x", "sp", [-1, 1, 32, 2]], ["tile_rc", "sp", [-1, 1]], ["tile_ry", "sp", [-1, 3]], ["tile_rx", "sp", [-1, 1]], ["auto_unroll_max_step", "ot", 1500], ["unroll_explicit", "ot", 1]]}, "result": [[0.0010015998871794871], 0, 3.2751452922821045, 1610524729.0056531], "version": 0.2, "tvm_version": "0.8.dev0"}
{"input": ["cuda -keys=cuda,gpu -max_num_threads=1024 -model=T4 -thread_warp_size=32", "conv2d_nchw.cuda", [["TENSOR", [2, 64, 256, 256], "float32"], ["TENSOR", [128, 64, 5, 5], "float32"], 1, [1, 1], 1, "float32"], {}], "config": {"index": 4967260, "code_hash": null, "entity": [["tile_f", "sp", [-1, 1, 1, 16]], ["tile_y", "sp", [-1, 2, 1, 1]], ["tile_x", "sp", [-1, 1, 127, 2]], ["tile_rc", "sp", [-1, 1]], ["tile_ry", "sp", [-1, 5]], ["tile_rx", "sp", [-1, 5]], ["auto_unroll_max_step", "ot", 1500], ["unroll_explicit", "ot", 1]]}, "result": [[0.010879299200000001], 0, 3.494727373123169, 1610525716.9155533], "version": 0.2, "tvm_version": "0.8.dev0"}
{"input": ["cuda -keys=cuda,gpu -max_num_threads=1024 -model=T4 -thread_warp_size=32", "conv2d_nchw.cuda", [["TENSOR", [2, 64, 256, 256], "float32"], ["TENSOR", [128, 64, 3, 3], "float32"], 1, [1, 1], 1, "float32"], {}], "config": {"index": 252297077, "code_hash": null, "entity": [["tile_f", "sp", [-1, 4, 4, 4]], ["tile_y", "sp", [-1, 1, 1, 2]], ["tile_x", "sp", [-1, 4, 32, 1]], ["tile_rc", "sp", [-1, 1]], ["tile_ry", "sp", [-1, 3]], ["tile_rx", "sp", [-1, 3]], ["auto_unroll_max_step", "ot", 1500], ["unroll_explicit", "ot", 0]]}, "result": [[0.004143269075], 0, 3.009106159210205, 1610526779.3333552], "version": 0.2, "tvm_version": "0.8.dev0"}
{"input": ["cuda -keys=cuda,gpu -max_num_threads=1024 -model=T4 -thread_warp_size=32", "conv2d_nchw.cuda", [["TENSOR", [2, 64, 128, 128], "float32"], ["TENSOR", [128, 64, 5, 5], "float32"], 1, [1, 1], 1, "float32"], {}], "config": {"index": 495616286, "code_hash": null, "entity": [["tile_f", "sp", [-1, 2, 1, 8]], ["tile_y", "sp", [-1, 3, 1, 2]], ["tile_x", "sp", [-1, 1, 126, 1]], ["tile_rc", "sp", [-1, 1]], ["tile_ry", "sp", [-1, 5]], ["tile_rx", "sp", [-1, 5]], ["auto_unroll_max_step", "ot", 1500], ["unroll_explicit", "ot", 1]]}, "result": [[0.0025459467826086956], 0, 2.4664502143859863, 1610528082.0925114], "version": 0.2, "tvm_version": "0.8.dev0"}
{"input": ["cuda -keys=cuda,gpu -max_num_threads=1024 -model=T4 -thread_warp_size=32", "conv2d_nchw.cuda", [["TENSOR", [2, 64, 128, 128], "float32"], ["TENSOR", [128, 64, 3, 3], "float32"], 1, [1, 1], 1, "float32"], {}], "config": {"index": 254513384, "code_hash": null, "entity": [["tile_f", "sp", [-1, 1, 2, 16]], ["tile_y", "sp", [-1, 1, 1, 4]], ["tile_x", "sp", [-1, 2, 64, 1]], ["tile_rc", "sp", [-1, 1]], ["tile_ry", "sp", [-1, 3]], ["tile_rx", "sp", [-1, 1]], ["auto_unroll_max_step", "ot", 1500], ["unroll_explicit", "ot", 1]]}, "result": [[0.0010263484413407821], 0, 3.5448105335235596, 1610529266.463075], "version": 0.2, "tvm_version": "0.8.dev0"}
{"input": ["cuda -keys=cuda,gpu -max_num_threads=1024 -model=T4 -thread_warp_size=32", "conv2d_nchw.cuda", [["TENSOR", [2, 64, 64, 64], "float32"], ["TENSOR", [128, 64, 5, 5], "float32"], 1, [1, 1], 1, "float32"], {}], "config": {"index": 5000458, "code_hash": null, "entity": [["tile_f", "sp", [-1, 1, 16, 2]], ["tile_y", "sp", [-1, 1, 31, 1]], ["tile_x", "sp", [-1, 1, 1, 31]], ["tile_rc", "sp", [-1, 2]], ["tile_ry", "sp", [-1, 5]], ["tile_rx", "sp", [-1, 5]], ["auto_unroll_max_step", "ot", 1500], ["unroll_explicit", "ot", 1]]}, "result": [[0.0008105864930875576], 0, 7.994316816329956, 1610530925.5051112], "version": 0.2, "tvm_version": "0.8.dev0"}
{"input": ["cuda -keys=cuda,gpu -max_num_threads=1024 -model=T4 -thread_warp_size=32", "conv2d_nchw.cuda", [["TENSOR", [2, 64, 64, 64], "float32"], ["TENSOR", [128, 64, 3, 3], "float32"], 1, [1, 1], 1, "float32"], {}], "config": {"index": 53834974, "code_hash": null, "entity": [["tile_f", "sp", [-1, 1, 4, 8]], ["tile_y", "sp", [-1, 1, 1, 8]], ["tile_x", "sp", [-1, 1, 32, 2]], ["tile_rc", "sp", [-1, 1]], ["tile_ry", "sp", [-1, 3]], ["tile_rx", "sp", [-1, 1]], ["auto_unroll_max_step", "ot", 1500], ["unroll_explicit", "ot", 0]]}, "result": [[0.00027278777831715213], 0, 4.883768558502197, 1610531886.887656], "version": 0.2, "tvm_version": "0.8.dev0"}
{"input": ["cuda -keys=cuda,gpu -max_num_threads=1024 -model=T4 -thread_warp_size=32", "conv2d_nchw.cuda", [["TENSOR", [2, 32, 256, 256], "float32"], ["TENSOR", [64, 32, 5, 5], "float32"], 1, [1, 1], 1, "float32"], {}], "config": {"index": 2467070, "code_hash": null, "entity": [["tile_f", "sp", [-1, 1, 1, 16]], ["tile_y", "sp", [-1, 1, 1, 2]], ["tile_x", "sp", [-1, 1, 127, 2]], ["tile_rc", "sp", [-1, 1]], ["tile_ry", "sp", [-1, 5]], ["tile_rx", "sp", [-1, 5]], ["auto_unroll_max_step", "ot", 512], ["unroll_explicit", "ot", 1]]}, "result": [[0.002788630903225806], 0, 5.303995132446289, 1610533183.2844036], "version": 0.2, "tvm_version": "0.8.dev0"}
{"input": ["cuda -keys=cuda,gpu -max_num_threads=1024 -model=T4 -thread_warp_size=32", "conv2d_nchw.cuda", [["TENSOR", [2, 32, 256, 256], "float32"], ["TENSOR", [64, 32, 3, 3], "float32"], 1, [1, 1], 1, "float32"], {}], "config": {"index": 151448376, "code_hash": null, "entity": [["tile_f", "sp", [-1, 2, 4, 8]], ["tile_y", "sp", [-1, 2, 1, 1]], ["tile_x", "sp", [-1, 4, 32, 1]], ["tile_rc", "sp", [-1, 1]], ["tile_ry", "sp", [-1, 3]], ["tile_rx", "sp", [-1, 3]], ["auto_unroll_max_step", "ot", 1500], ["unroll_explicit", "ot", 0]]}, "result": [[0.0010660217570621468], 0, 3.0805273056030273, 1610534613.2363381], "version": 0.2, "tvm_version": "0.8.dev0"}
{"input": ["cuda -keys=cuda,gpu -max_num_threads=1024 -model=T4 -thread_warp_size=32", "conv2d_nchw.cuda", [["TENSOR", [2, 32, 128, 128], "float32"], ["TENSOR", [64, 32, 5, 5], "float32"], 1, [1, 1], 1, "float32"], {}], "config": {"index": 297473682, "code_hash": null, "entity": [["tile_f", "sp", [-1, 4, 1, 2]], ["tile_y", "sp", [-1, 2, 1, 3]], ["tile_x", "sp", [-1, 1, 126, 1]], ["tile_rc", "sp", [-1, 1]], ["tile_ry", "sp", [-1, 5]], ["tile_rx", "sp", [-1, 5]], ["auto_unroll_max_step", "ot", 1500], ["unroll_explicit", "ot", 1]]}, "result": [[0.0006749508678571428], 0, 5.434271574020386, 1610535955.4293962], "version": 0.2, "tvm_version": "0.8.dev0"}
{"input": ["cuda -keys=cuda,gpu -max_num_threads=1024 -model=T4 -thread_warp_size=32", "conv2d_nchw.cuda", [["TENSOR", [2, 32, 128, 128], "float32"], ["TENSOR", [64, 32, 3, 3], "float32"], 1, [1, 1], 1, "float32"], {}], "config": {"index": 152722319, "code_hash": null, "entity": [["tile_f", "sp", [-1, 1, 4, 8]], ["tile_y", "sp", [-1, 4, 1, 1]], ["tile_x", "sp", [-1, 2, 32, 1]], ["tile_rc", "sp", [-1, 1]], ["tile_ry", "sp", [-1, 3]], ["tile_rx", "sp", [-1, 1]], ["auto_unroll_max_step", "ot", 1500], ["unroll_explicit", "ot", 1]]}, "result": [[0.0002782753934659091], 0, 3.0558106899261475, 1610537398.2640345], "version": 0.2, "tvm_version": "0.8.dev0"}
{"input": ["cuda -keys=cuda,gpu -max_num_threads=1024 -model=T4 -thread_warp_size=32", "conv2d_nchw.cuda", [["TENSOR", [2, 32, 64, 64], "float32"], ["TENSOR", [64, 32, 5, 5], "float32"], 1, [1, 1], 1, "float32"], {}], "config": {"index": 1434863, "code_hash": null, "entity": [["tile_f", "sp", [-1, 2, 4, 4]], ["tile_y", "sp", [-1, 1, 1, 2]], ["tile_x", "sp", [-1, 1, 31, 2]], ["tile_rc", "sp", [-1, 1]], ["tile_ry", "sp", [-1, 5]], ["tile_rx", "sp", [-1, 5]], ["auto_unroll_max_step", "ot", 1500], ["unroll_explicit", "ot", 0]]}, "result": [[0.00021719508903225807], 0, 2.7709686756134033, 1610539055.0807173], "version": 0.2, "tvm_version": "0.8.dev0"}
{"input": ["cuda -keys=cuda,gpu -max_num_threads=1024 -model=T4 -thread_warp_size=32", "conv2d_nchw.cuda", [["TENSOR", [2, 32, 64, 64], "float32"], ["TENSOR", [64, 32, 3, 3], "float32"], 1, [1, 1], 1, "float32"], {}], "config": {"index": 75468115, "code_hash": null, "entity": [["tile_f", "sp", [-1, 1, 4, 16]], ["tile_y", "sp", [-1, 1, 1, 4]], ["tile_x", "sp", [-1, 1, 64, 1]], ["tile_rc", "sp", [-1, 2]], ["tile_ry", "sp", [-1, 3]], ["tile_rx", "sp", [-1, 1]], ["auto_unroll_max_step", "ot", 1500], ["unroll_explicit", "ot", 1]]}, "result": [[7.412276144688644e-05], 0, 3.6098179817199707, 1610540860.9707599], "version": 0.2, "tvm_version": "0.8.dev0"}
